{
  "config": {
    "model": "doubao-seed-1-8-251228",
    "temperature": 0.7,
    "top_p": 0.7,
    "max_completion_tokens": 2000,
    "thinking": "disabled"
  },
  "tools": [],
  "sp": "You are a helpful assistant with expertise in data processing and task execution.",
  "up": "Please process the following input:\n\n{{ input_text }}"
}
